{
  "sampleName": "Fictional cacao powder",
  "productSku": "DEMO-CACAO-01",
  "lotNumber": "FICTIONAL-LOT-2026-01",
  "matrix": "Food · Powder",
  "method": "Fictional demonstration method",
  "submittingParty": "Example Brand (fictional)",
  "releasedAt": "2026-09-01",
  "visibility": "public",
  "publish": true,
  "sourceDocument": {
    "sha256": "0123456789abcdef0123456789abcdef0123456789abcdef0123456789abcdef",
    "filename": "fictional-laboratory-report.pdf",
    "reportNumber": "DEMO-REPORT-001"
  },
  "proof": {
    "keyId": "fictional.example/key/demo-01",
    "algorithm": "Ed25519",
    "signature": "FICTIONAL_BASE64URL_SIGNATURE_NOT_VALID_FOR_PRODUCTION"
  },
  "results": [
    {
      "analyte": "Lead",
      "symbol": "Pb",
      "resultText": "42",
      "numericValue": 42,
      "unit": "µg/kg",
      "loqText": "10",
      "method": "Fictional demonstration method"
    }
  ]
}
